{
  "schema_version": "0.2.0",
  "repository": {
    "full_name": "Loofy147/moaziz-supreme-engine",
    "url": "https://github.com/Loofy147/moaziz-supreme-engine",
    "default_branch": "master",
    "visibility": "private",
    "archived": false
  },
  "observation": {
    "observed_at": "2026-09-22",
    "ref": "master",
    "commit": "44b4268281437a6b19a502b0812317a4f32a236d",
    "branches_inspected": [
      "master"
    ],
    "surfaces_inspected": [
      "AUDIT_REPORT.md",
      "SKILL.md",
      "scripts/validate_realizations.py",
      "scripts/tests/test_engine.py",
      "scripts/moaziz_engine/scoring.py",
      "scripts/moaziz_engine/improvement.py",
      "pyproject.toml",
      "recent commit history"
    ],
    "depth": "D3"
  },
  "state": {
    "project_status": "CURRENT",
    "interpretation": "A bounded decision-support library with strong evidence/provenance/rollback framing and deterministic unit tests; useful as a design/reference primitive, but its Q-Score and graph methods remain local heuristics rather than validated general methods."
  },
  "evidence": [
    {
      "class": "OBSERVED",
      "claim_status": "ESTABLISHED",
      "statement": "The audit report explicitly removed or corrected unsupported APIs, benchmark claims, overconfident epistemology, unsafe autonomy framing, and missing dataset provenance.",
      "source": "AUDIT_REPORT.md",
      "limits": "Audit conclusions are repository-authored and have not been independently rerun in this review."
    },
    {
      "class": "OBSERVED",
      "claim_status": "EXPERIMENTALLY_SUPPORTED",
      "statement": "The library exposes immutable typed records, ingestion, deterministic scoring, bounded graph propagation/path search, and versioned improvement gates, with no runtime dependencies.",
      "source": "AUDIT_REPORT.md, SKILL.md, scoring.py, improvement.py",
      "limits": "Implementation existence is not evidence that the methods are generally effective."
    },
    {
      "class": "OBSERVED",
      "claim_status": "EXPERIMENTALLY_SUPPORTED",
      "statement": "The unit suite explicitly tests missing-evidence penalties, invalid score rejection, bounded/damped propagation, declared-cost path selection, legacy ingestion warnings, normalized utility constraints, regression rejection, and human-reviewed canary gating.",
      "source": "scripts/tests/test_engine.py",
      "limits": "Tests are unit-level and do not establish external-task performance, calibration, or deployment safety."
    },
    {
      "class": "OBSERVED",
      "claim_status": "EXPERIMENTALLY_SUPPORTED",
      "statement": "The realization validator checks structure/score consistency and warns on empty evidence and unsafe instrumental-convergence terms, while explicitly stating that it does not verify truth.",
      "source": "scripts/validate_realizations.py",
      "limits": "Structural validation cannot validate the semantics or factual truth of realization claims."
    },
    {
      "class": "OBSERVED",
      "claim_status": "UNKNOWN",
      "statement": "The audit report claims successful execution of validators and tests, but the current repository exposes no CI workflow run in the connected workflow endpoint for the observed head.",
      "source": "AUDIT_REPORT.md and GitHub workflow-run endpoint",
      "limits": "No CI run does not prove the local reported execution did not occur."
    }
  ],
  "assumptions": [],
  "suggestions": [
    "Reuse the provenance/uncertainty/improvement-gate patterns in UWS as methodology, not as an already-validated scoring engine.",
    "Keep Q-Score explicitly subordinate to claim-level evidence status and never let it become an aggregate truth score."
  ],
  "decisions": [],
  "unknowns": [
    "Calibration and predictive validity of Q-Score under real UWS evidence.",
    "Whether bounded propagation adds measurable value over simpler relationship traversal.",
    "Whether the improvement gate remains safe and useful under adversarial or high-impact workloads."
  ],
  "contradictions": [
    "The repository's current implementation posture is bounded and non-self-certifying, while its product name and some framing use 'Self-Evolving Realization Engine'; current SKILL.md resolves this by explicitly defining it as decision-support and requiring human approval."
  ],
  "relationships": [
    {
      "target": "Loofy147/unified-knowledge-work-system",
      "relation": "RELEVANT_REUSABLE_PRIMITIVE",
      "status": "DERIVED",
      "evidence_refs": [
        "moaziz-supreme-engine: SKILL.md",
        "moaziz-supreme-engine: test_engine.py",
        "moaziz-supreme-engine: improvement.py"
      ],
      "notes": "Useful reference for uncertainty, provenance, constrained utility, reversible improvement, and human gates; do not import its aggregate score as a truth metric."
    }
  ],
  "verification": {
    "tests_inspected": [
      "scripts/tests/test_engine.py",
      "scripts/validate_realizations.py"
    ],
    "tests_executed": [],
    "artifacts": [
      "AUDIT_REPORT.md",
      "pyproject.toml"
    ],
    "reproducibility": "Repository reports 7 library tests and original source tests passing; this review independently inspected test code but did not execute it.",
    "falsifiers": [
      "Real UWS trials show Q-Score or graph propagation decreases calibration or increases unsupported promotion compared with simpler claim-level controls.",
      "Improvement-gate behavior fails under adversarial edge cases not covered by unit tests."
    ]
  },
  "next_test": "Construct a UWS claim-review fixture using the library's provenance/uncertainty/gating patterns while keeping truth status claim-level and compare against UWS baseline review logic."
}
