{
  "schema_version": "0.2.0",
  "repository": {
    "full_name": "Loofy147/Bounties",
    "url": "https://github.com/Loofy147/Bounties",
    "default_branch": "main",
    "visibility": "public",
    "archived": false
  },
  "observation": {
    "observed_at": "2026-09-22",
    "ref": "main",
    "commit": "8a2663df4bcf214c9642c4351d7f3cae6a097d54",
    "branches_inspected": [
      "main"
    ],
    "surfaces_inspected": [
      "README.md",
      "targets/",
      "research/",
      "archive/",
      "evidence lifecycle references"
    ],
    "depth": "D3"
  },
  "state": {
    "project_status": "CURRENT",
    "interpretation": "Security-research workspace with an explicit evidence lifecycle and human submission gate. High methodological relevance to UWS verification, but the track is security-sensitive and externally scoped."
  },
  "evidence": [
    {
      "class": "OBSERVED",
      "claim_status": "ESTABLISHED",
      "statement": "Every bounty candidate is classified through RECONNAISSANCE→HYPOTHESIS→REPRODUCED→IN-SCOPE→SUBMITTED→ACCEPTED→PAID→REJECTED, and hypotheses are not promoted to findings solely because they sound plausible.",
      "source": "README.md",
      "limits": "The workflow discipline is repository-defined; successful external outcomes are not established by this review."
    },
    {
      "class": "OBSERVED",
      "claim_status": "ESTABLISHED",
      "statement": "The reusable hunter model requires target snapshot, state model, security invariant, controlled experiment, evidence, independent validation, impact, minimized counterexample, scope/novelty gate, and human review.",
      "source": "README.md",
      "limits": "The model does not by itself prove that each target dossier implements every stage."
    },
    {
      "class": "OBSERVED",
      "claim_status": "ESTABLISHED",
      "statement": "The repository explicitly requires work to remain within bounty scope and permitted test environments and forbids publishing secrets or harmful exploit instructions.",
      "source": "README.md",
      "limits": "Compliance with external program rules still has to be checked target by target."
    },
    {
      "class": "OBSERVED",
      "claim_status": "USER_REPORTED",
      "statement": "The current B0 target is 1inch Smart Contracts / Limit Order Protocol and the stated objective is to obtain a first legitimate externally accepted paid finding.",
      "source": "README.md",
      "limits": "This is project-authored current objective, not an externally verified outcome or forecast."
    },
    {
      "class": "INFERRED",
      "claim_status": "HYPOTHESIS",
      "statement": "The transferable UWS primitive is the hypothesis-to-reproduction-to-independent-validation state machine, not the security payloads or target-specific attack logic.",
      "source": "Synthesis of README methodology",
      "limits": "Should be reused only for benign verification state tracking and controlled experiments."
    }
  ],
  "suggestions": [
    "Extract the evidence lifecycle as a generic UWS verification state machine without importing target-specific security procedures.",
    "Preserve human authorization as a hard transition before externally consequential actions."
  ],
  "decisions": [],
  "unknowns": [
    "Current target dossier completeness.",
    "Independent external acceptance history.",
    "Whether the lifecycle has reusable automated invariants beyond the documented process."
  ],
  "contradictions": [],
  "relationships": [
    {
      "target": "Loofy147/unified-knowledge-work-system",
      "relation": "RELEVANT_REUSABLE_PRIMITIVE",
      "status": "INFERRED",
      "evidence_refs": [
        "Bounties: evidence lifecycle",
        "Bounties: hunter architecture"
      ],
      "notes": "Methodological reference for verification state progression and human approval gates; security operations remain out of scope for direct import."
    }
  ],
  "verification": {
    "tests_inspected": [],
    "tests_executed": [],
    "artifacts": [
      "README.md",
      "target/research/archive directory model"
    ],
    "reproducibility": "The state-machine methodology is explicitly documented; execution evidence for the current external target was not independently inspected here.",
    "falsifiers": [
      "Concrete target records show stages are merely labels without evidence invariants or reproducible artifacts.",
      "Automation of state transitions cannot preserve human authorization boundaries."
    ]
  },
  "next_test": "Model one generic UWS validation workflow as the same lifecycle with non-security fixtures and enforce allowed state transitions plus evidence requirements."
}
