{
  "schema_version": "0.2.0",
  "repository": {
    "full_name": "Loofy147/algeria-digital-venture-operating-system",
    "url": "https://github.com/Loofy147/algeria-digital-venture-operating-system",
    "default_branch": "main",
    "visibility": "public",
    "archived": false
  },
  "observation": {
    "observed_at": "2026-09-22",
    "ref": "main",
    "commit": "beb11e4bf1b6d949cb47ff5e73422271068da020",
    "branches_inspected": [
      "main"
    ],
    "surfaces_inspected": [
      "package.json",
      "client/server/shared/template structure from census triage",
      "current main commit diff"
    ],
    "depth": "D2"
  },
  "state": {
    "project_status": "CURRENT",
    "interpretation": "Substantive dashboard scaffold reframed as a venture operating system, with build/typecheck tooling and broad UI/content surfaces; dedicated test/CI evidence is not established at the inspected root."
  },
  "evidence": [
    {
      "class": "OBSERVED",
      "claim_status": "ESTABLISHED",
      "statement": "package.json provides development, build, start, preview, typecheck, and formatting scripts but no test script.",
      "source": "package.json",
      "limits": "A repository can contain tests without a package test script; test absence is therefore not proven by this field alone."
    },
    {
      "class": "OBSERVED",
      "claim_status": "ESTABLISHED",
      "statement": "The current main commit reframes the dashboard around recurring operating cycles, service/runtime choices, evidence, validation, compliance, and product operations rather than the earlier market-dashboard copy.",
      "source": "main commit beb11e4bf1b6d949cb47ff5e73422271068da020",
      "limits": "This establishes product content at the commit; effectiveness of the operating model remains untested."
    },
    {
      "class": "OBSERVED",
      "claim_status": "UNKNOWN",
      "statement": "No root GitHub Actions workflow or current workflow run was established during this review.",
      "source": "Connected repository surface inspection",
      "limits": "Absence of a surfaced workflow does not prove that external CI exists elsewhere."
    },
    {
      "class": "INFERRED",
      "claim_status": "HYPOTHESIS",
      "statement": "The strongest UWS relevance is as a human-facing operating-cycle presentation layer for evidence/decisions, not as the underlying orchestration or provenance substrate.",
      "source": "Synthesis of current main product surface",
      "limits": "The UI may encode useful interaction patterns, but durable state semantics are not established."
    }
  ],
  "suggestions": [
    "Keep the operating-cycle UX separate from UWS authoritative state and evidence services.",
    "Promote any repeated workflow primitive only after backing it with persisted state, explicit provenance, and tests."
  ],
  "decisions": [],
  "unknowns": [
    "Actual server-side persistence behavior.",
    "Presence and quality of test suites outside package scripts.",
    "Whether the runtime/service selection logic is descriptive only or connected to executable provisioning."
  ],
  "contradictions": [],
  "relationships": [
    {
      "target": "Loofy147/unified-knowledge-work-system",
      "relation": "POTENTIAL_REFERENCE",
      "status": "INFERRED",
      "evidence_refs": [
        "algeria-digital-venture-operating-system: current main"
      ],
      "notes": "Potential UX/reference surface for recurring operating cycles; not evidence for underlying orchestration capabilities."
    }
  ],
  "verification": {
    "tests_inspected": [],
    "tests_executed": [],
    "artifacts": [
      "package.json",
      "current main commit"
    ],
    "reproducibility": "Structural observation only; no root CI execution established.",
    "falsifiers": [
      "Direct inspection reveals a durable tested operating-system core with reusable orchestration primitives.",
      "A CI/test surface demonstrates stronger implementation evidence than the current structural review."
    ]
  },
  "next_test": "Inspect server/shared behavior and any existing test files, then establish whether the operating-cycle concepts are backed by durable state and verifiable transitions."
}
